,nr,adres,typ,niep,granice
181,182,"Szkoła Podstawowa Nr 133, ul. Wrony 115, Kraków",Powszechny,Tak,"Błotniska, Chlebiczna, Działowskiego, Hollendra, Kochmańskiego, Kołaczkowskiego, Księdza Trockiego, Medalionów, Na Klińcu, Nałkowskiej, Petrażyckiego parzyste od 62 i nieparzyste od 41, Podgórki Tynieckie od 1 do 23, Prażmowskiego, Profesora Opałka, Radłowa, Sapalskiego, Skotnicka parzyste od 252 i nieparzyste od 231, Solówki nieparzyste, Topografów, Tretówka, Wapowskiego, Warchałowskiego, Wrony, Zagumnie, Zientary, Żyzna"
182,183,"Dom Kultury ""Podgórze"", Klub Osiedlowy ""Tyniec"", ul. Dziewiarzy 7 Kraków",Powszechny,Tak,"Bagienna, Benedyktyńska, Bogucianka, Bolesława Śmiałego, Browarniana, Bór, Danusi Jurandówny, Dziewiarzy, Fedkowicza, Grodzisko, Heligundy, Janasówka, Juranda ze Spychowa, Lutego Tura, Maćka z Bogdańca, Nad Czerną, Obrony Tyńca, Podgórki Tynieckie od 24 (bez 96), Promowa, Skołczanka, Stępice, Świętojańska, Szczygielskiego, Toporczyków, Walgierza Wdałego, Wielogórska, Zagórze, Zakleśnie"
183,184,"Szkoła Podstawowa Nr 54, ul. Tyniecka 122, Kraków",Powszechny,Tak,"Brzask, Bobrowa, Bodzowska, Bojanówka, Dąbrowa, Falista, Fosa, Granitowa, Gronowa, Jachimeckiego, Kaktusowa, Kolarzy, Kolna, Kostrzecka, Krzewowa, Nierówna, Osiedle Srebrne Uroczysko, Profesora Ślaskiego, Pustelnia, Tyniecka nieparzyste od 137 i parzyste od 118 f, Widłakowa nieparzyste od 13 i parzyste od 10, Wielkanocna, Zaciernie"
184,185,"Szkoła Podstawowa Nr 62, ul. Ćwikłowa 1, Kraków",Powszechny,Tak,"Bażanki, Ćwikłowa, Ekielskiego, Harasymowicza, Jemiołowa, Krasowa, Księżarskiego, Moraczewskiego, Na Leszczu, Odrzywolskiego, Pokutyńskiego, Prylińskiego, Przełom, Rodzinna, Skalica, Słońskiego, Sodowa, Świętego Piotra, Talowskiego, Tyniecka nieparzyste od 47 do 135 i parzyste od 46 do 118 e, Widłakowa nieparzyste od 1 do 11 i parzyste od 2 do 8b, Wzgórze, Zakrzowiecka"
185,186,"Specjalny Ośrodek Szkolno - Wychowawczy Nr 3, ul. Praska 64, Kraków",Powszechny,Tak,"Do Groty, Łosiówka, Norymberska, Patynów, Pietrusińskiego, Praska nieparzyste od 27 i parzyste od 52, Tyniecka od 23 do 45, Zielna nieparzyste od 107"
186,187,"Zespół Szkół Łączności, ul. Monte Cassino 31, Kraków",Powszechny,Nie,"Biała Droga, Boczna, Bułhaka, Czarodziejska, Czechosłowacka, Dębnicka, Dworska, Generała Zielińskiego, Jaworowa, Kapelanka 1, 1 a, Księdza Pawlickiego, Mieszczańska, Mitkowskiego, Monte Cassino, Nowaczyńskiego ( bez Nr 1), Obrońców Poczty Gdańskiej, Praska nieparzyste od 1 do 23 i parzyste od 2 do 50, Szwedzka nieparzyste od 1 do 49 i parzyste od 36 do 50, Twardowskiego od 1 do 67, Tyniecka od 10a do 21, Wierzbowa, Wygrana, Zagonów, Zielna parzyste, nieparzyste od 31 do 105"
187,188,"Zespół Szkół Łączności, ul. Monte Cassino 31, Kraków",Powszechny,Nie,"Ceglarska, Kapelanka nieparzyste od 23 do 29 i parzyste od 2 do 40 , Salezjańska, Świętego Jacka, Twardowskiego od 68, Wyłom"
188,189,"Gimnazjum Nr 22, ul. Skwerowa 3, Kraków",Powszechny,Nie,"Bałuckiego, Dębowa, Konfederacka, Pułaskiego nieparzyste od 7 i parzyste od 10, Rolna, Szwedzka parzyste od 2 do 34, Skwerowa, Tyniecka od 1 do 10, Wasilewskiego, Zagrody, Zielna nieparzyste od 1 do 29"
189,190,"Gimnazjum Nr 22, ul. Skwerowa 3, Krakowa",Powszechny,Nie,"Barska nieparzyste od 1 do 45 i parzyste od 2 do 42, Kilińskiego, Konopnickiej nieparzyste od 1 do 45 i parzyste od 2 do 36, Madalińskiego, Powroźnicza, Pułaskiego nieparzyste od 1 do 5 i parzyste od 2 do 8, Rynek Dębnicki, Różana, Sandomierska, Zamkowa, Zduńska"
190,191,"Zespół Szkół Ogólnokształcących Integracyjnych Nr 2, ul. Lipińskiego 2, Kraków",Powszechny,Tak,Kobierzyńska parzyste od 16 do 102
191,192,"Zespół Szkół Ogólnokształcących Integracyjnych Nr 2, ul. Lipińskiego 2, Kraków",Powszechny,Tak,"Kapelanka parzyste od 44, i nieparzyste 39 i od 57, Lipińskiego bez Nr 11, 13, 15, 17, Miłkowskiego"
192,193,"Zespół Szkół Ogólnokształcących Integracyjnych Nr 2, ul. Lipińskiego 2, Kraków",Powszechny,Tak,"Rostworowskiego, Grota-Roweckiego nieparzyste od 1 do 33 i 8, Kamieniarska, Kobierzyńska nieparzyste od 1 do 89, Profesora Łojasiewicza, Pychowicka"
193,194,"Gimnazjum Nr 21, ul. Komandosów 29, Kraków",Powszechny,Nie,"Barska parzyste od 44 i nieparzyste od 47, Komandosów nieparzyste od 11 do 29, Konopnickiej nieparzyste od 47 do 69, Ludwinowska, Na Ustroniu, Swoboda, Turecka, Zatorska"
194,195,"Gimnazjum Nr 21, ul. Komandosów 29, Kraków",Powszechny,Nie,Komandosów od 1 do 9
195,196,"Szkoła Podstawowa Nr 25, ul. Komandosów 29, Kraków",Powszechny,Nie,"Komandosów parzyste od 10 do 18, Słomiana nieparzyste od 1 do 15, Szwedzka od 51"
196,197,"Szkoła Podstawowa Nr 25, ul. Komandosów 29, Kraków",Powszechny,Nie,"Słomiana 2, 4, 6, 8, 10, 12, 14, 16, 18, 20, 22, 22a, 24, , "
197,198,"Szkoła Podstawowa Nr 25, ul. Komandosów 29, Kraków",Powszechny,Nie,"Słomiana 19, 19a, 21, 21b, 23, 25, 27, 27a, 27b, 27c, Kapelanka 3, 3a, 3b, 5, 5a, 5b, 11, 13, 15, 15a, Rozdroże"
198,199,"Gimnazjum Nr 24, ul. Montwiłła - Mireckiego 29, Kraków",Powszechny,Tak,"Dekarzy, Falowa, Gajowa, Goplana, Huculska, Irysowa, Ludwisarzy, Łukasińskiego, Micińskiego, Młynowa, Piaseckiego, Ruczaj parzyste od 2 do 20 i nieparzyste od 1 do 15g, Światowida, Świebodzicka, Tokarska , Turonia parzyste, Tynkarzy, Zaborze, Zbrojarzy nieparzyste od 1 do 83 i parzyste, Zdunów od 19"
199,200,"Gimnazjum Nr 24, ul. Montwiłła - Mireckiego 29, Kraków",Powszechny,Tak,"Chłodna, Kościuszkowców, Kowalska, Krochmalniki, Miła, Montwiłła-Mireckiego, Na Zrębie, Niecała, Niemcewicza, Nowogródzka, Okrzei, Podhalańska parzyste, Rynek Fałęcki, Tęczowa, Zakopiańska nieparzyste od 73 do 97, Zdunów od 1 do 18a, b,  Żywiecka od 1 do 11"
200,201,"Centrum Aktywnego Wypoczynku Klub Sportowy ""Borek"", ul. Żywiecka 13, Kraków",Powszechny,Tak,"Borkowskie Błonia, Cesarza, Doktora Łuczyńskiego, Druhny Hanki, Krępy, Księdza Karabuły, Księdza Zagrodzkiego, Kułakowskiego, Obozowa parzyste (bez nr 2, 8, 12, 16, 16a, 20, 22, 22a, 24, 24abc, 38, 38a), Starca, Solvaya, Szczerbińskiego, Ziobrowskiego, Żywiecka nieparzyste od 13 i parzyste od 50"
201,202,"Centrum Aktywnego Wypoczynku Klub Sportowy ""BOREK"", ul. Żywiecka 13, Kraków",Powszechny,Tak,"Goryczkowa, Jagodowa parzyste od 2 do 12 i nieparzyste od 11 do 19, Kępna, Żywiecka parzyste od 12 do 48"
202,203,"Centrum Sztuki Współczesnej ""Solvay"", ul. Zakopiańska 62, Kraków",Powszechny,Tak,"Borowinowa 77, Jeleniogórska, Jugowicka parzyste, Herberta 8, 10, 12, 14, Marcika, Modra, Orzechowa, Podmokła, Sielska, Zakopiańska parzyste od 54 do 86 i nieparzyste od 99 do 145, Osiedle Zaułek Jugowicki, Zawiła nieparzyste od 1 do 49"
203,204,"Zespół Szkół Ogólnokształcących Nr 17, ul. Fredry 65, Kraków",Powszechny,Nie,"Chmielna nieparzyste, Chochołowska, Do Sanktuarium Bożego Miłosierdzia, Fredry, Generała Roi 4, 4a, 4b, 6, Goslara, Harcerska, Harcmistrza Millana ( bez nr 22), Kołodziejska, Kurasia, Kwietna, Lechicka, Malutka, Motarskiego, Myślenicka nieparzyste od 1 do 45 i parzyste od 2 do 32, Na Grządkach, Ogrodniki, Pasieczna, Pierzchówka parzyste, Pocztowa, Połomskiego, Porucznika Wąchały, Przykopy nieparzyste od 1 do 7, Przy Torze, Ratajska, Siostry Faustyny, Strumienna nieparzyste i parzyste od 2 do 14, Sucha, Sowia, Sobótka, Urocza, Włodarska, Zakopiańska parzyste od 2 do 52a, Żmichowskiej"
204,205,"Miejskie Przedsiębiorstwo Komunikacyjne, ul. Brożka 3, Kraków",Powszechny,Tak,"Bogdanowicza, Borsucza 1, 3, 3a i parzyste od 2 do 8, Brożka parzyste, Cegielniana nieparzyste od 1 do 45, Kędzierzyńska, Kołobrzeska, Koszalińska, Lasek, Nowotarska, Pienińska, Plac Łagiewnicki, Słupska, Szaniawskiego, Wałbrzyska, Zielonogórska"
205,206,"Miejskie Przedsiębiorstwo Komunikacyjne, ul. Brożka 3, Kraków",Powszechny,Tak,"Cegielniana parzyste od 2, Ciesielska, Deotymy, Do Wilgi, Hoffmanowej, Oraczy, Zakopiańska nieparzyste od 1 do 71"
206,207,"Zespół Szkół Ogólnokształcących Integracyjnych Nr 3 ul. Strąkowa 3a, Kraków",Powszechny,Tak,"Borsucza nieparzyste od 5 i parzyste od 10, Cegielniana nieparzyste od 47, Kusocińskiego, Lipińskiego 11, 13, 15, 17, Strąkowa, Odrzańska"
207,208,"Klub Kultury ""Kosocice"", ul. Sztautyngera 5, Kraków",Powszechny,Nie,"Barycka, Blacharska, Gacki, Gąsiorowskiego, Gruszczyńskiego nieparzyste od 1 do 31 i parzyste od 2 do 42, Hallera parzyste od 16 i nieparzyste od 9, Harcerzy Krakowskich, Hoborskiego, Kosocicka 73, 75, 75 a, 75 b,  Koszutki, Krzemieniecka nieparzyste od 35 i parzyste od 34, Lande, Niebieska od 11, Osterwy nieparzyste od 1 do 19 a, parzyste od 2 do 16, Pawłowskiego, Sczanieckiej, Szczegów, Sztaudyngera, Żelazowskiego"
208,209,"Klub Osiedlowy, ul. Kuryłowicza 115, Kraków",Powszechny,Nie,"Berdyczowska, Chanieckiej, Drużbackiej, Geologów, Gombrowicza, Gruszczyńskiego parzyste od 44 i nieparzyste od 33, Jarockiego, Jasiukowicza, Krzemieniecka nieparzyste od 1 do 33 i parzyste od 2 do 32, Kukiełek Golkowickich, Kuryłowicza nieparzyste od 71 i parzyste od 52, Malinowskiego, Na Obrydki, Pajdaka, Ratajskiego, Schőnborna"
209,210,"Stowarzyszenie Rajska-Szkoła, ul. Tuchowska 113, Kraków",Powszechny,Nie,"Bełzy, Do Luboni od 61, Droga Rokadowa, Gdowska, Golkowicka, Grawerska, Kenara nieparzyste od 1 do 35, 35 a, parzyste od 2 do 18, Kuryłowicza nieparzyste od 1 do 69, parzyste od 2 do 50, Landaua nieparzyste, Matematyków Krakowskich nieparzyste od 1 do 27, 27a, Miarowa nieparzyste od 37 i parzyste od 20, Na Pokusie, Nad Fosą, Orszańska, Osterwy nieparzyste od 21 i parzyste od 18, Rytownicza, Szczawnicka, Tuchowska nieparzyste od 41 i parzyste od 50"
210,211,"Filia Szkoły Podstawowej Nr 43, ul. Zbydniowicka 1, Kraków",Powszechny,Nie,"Gołąba, Lei, Matematyków Krakowskich parzyste od 26 i nieparzyste od 57, Opiala, Szarskiego, Zbydniowicka"
211,212,"Szkoła Podstawowa Nr 135, ul. Mirtowa 2, Kraków",Powszechny,Nie,"Bogdanowskiego, Chałubińskiego nieparzyste od 85 i parzyste od 104, Czuchnowskiego, Doroszewskiego, Drużka, Familijna, Gilowa, Herbowa, Iwaszkiewicza, Kenara parzyste od 20 nieparzyste od 37, Koźmiana, Księdza Kajzera, Landaua parzyste, Łysogórska, Matematyków Krakowskich parzyste od 2 do 24, Mirtowa, Myślenicka nieparzyste od 189 i parzyste od 164, Niewodniczańskiego od 1 do 39, Parafialna, Profesora Bochnaka, Syreńskiego, Wróblowicka parzyste od 8 i nieparzyste od 11"
212,213,"Klub Osiedlowy, ul. Niewodniczańskiego 74, Kraków",Powszechny,Tak,"Aleksandrowicza, Chrzanowskiego, Gościnna, Grzepskiego, Krzyżańskiego, Niewodniczańskiego od 40, Nowickiego"
213,214,"Szkoła Podstawowa Nr 43, ul. Myślenicka 112, Kraków",Powszechny,Nie,"Babiego Lata (bez 24), Borowinowa (bez 77), Chałubińskiego nieparzyste od 1 do 83 i parzyste od 2 do 102, Czyrniańskiego, Druskiennicka, Kąpielowa nieparzyste od 11 i parzyste od 12 ( bez 70), Krzyżanowskiego, Lasogórska, Lusińska, Łobodowskiego, Moszyńskiego, Muszyńskiego, Neussera, Piłkarska, Pytlasińskiego, Rabczańska, Sanatoryjna, Starowiejska od 12, Wczasowa, Wypoczynkowa"
214,215,"Szkoła Podstawowa Nr 43, ul. Myślenicka 112, Kraków",Powszechny,Nie,"Gorczyna, Hypty, Iwonicka, Jar, Jelskiego, Jeździecka, Korczyńskiego, Kotowskiego, Lecznicza, Merkuriusza Polskiego, Miarowa nieparzyste od 1 do 35 i parzyste od 2 do 16, 16a, Michalika, Moczydło, Morozewicza, Myślenicka nieparzyste od 79 do 187 i parzyste od 62 do 162, Nałęczowska, Niedźwiedziny, Opalińskiego, Perłowa, Pinocci, Podgórki, Podhalnie, Przyrodnicza, Rymanowska, Sawiczewskich, Siarczanogórska, Siarczki, Soboniowicka, Srzednickiego, Stawisko, Stepowa , Szybisko, Topiarnia, Truskawiecka, Uzdrowiskowa, Warszewicza, Wierchowa, Wróblowicka parzyste od 2 do 6 i nieparzyste od 1 do 9, Wyrwa, Wyżynna, Zaruskiego, Zdrojowa"
215,216,"Filia Szkoły Podstawowej Nr 97, ul. Armii Kraków 76, Kraków",Powszechny,Tak,"Armii Kraków, Białostocka, Bieszczadzka, Ciechocińska, Ciepła, Ciołkosza, Goździkowa, Horaka, Hubalczyków, Jasielska, Jugowicka nieparzyste, Kaliska, Kąpielowa nieparzyste od 1 do 9 i parzyste od 2 do 10, Kierzkowskiego, Kokosowa, Kolejarzy, Krośnieńska, Kustronia, Nowodworskiego, Owocowa, Siarczana, Szumca, Szyllinga, Tulipanowa, Zakopiańska parzyste od 88 do 194"
216,217,"Szkoła Podstawowa Nr 97, ul. Dr Judyma 10, Kraków",Powszechny,Nie,"Borkowska, Czołgistów, Kadłubka, Kluka, Nenko, Wichrowa, Żaków Krakowskich"
217,218,"Szkoła Podstawowa Nr 97, ul. Doktora Judyma 10, Kraków",Powszechny,Nie,"Bastionowa, Bluszczowa, Czajkowskiego, Dębickiego, Fałęcka, Janowskiego, Księżycowa, Marusarzówny, Narvik, Pustynna, Siostry Zimmer, Skrzetuskiego, Szmaragdowa, Zawiła parzyste od 2 do 40"
218,219,"Szkoła Podstawowa Nr 97, ul. Doktora Judyma 10, Kraków",Powszechny,Nie,"Amarantowa, Banachiewicza, Bellerta, Boratyńskiego, Chęcińska, Chojnicka, Ciechanowska, Czerska, Doktora Judyma, Eibischa, Forteczna, Gadomskiego, Gałęzowskiego, Gumowskiego, Homolacsa, Kępińskiego, Kopernickiego, Korpala od 21, Kostrzewskiego, Krzyżtoporska, Księdza Dercza, Księdza Mączyńskiego, Kwiatowa, Łódzka, Maklakiewicza, Mieczykowa,  Miodońskiego, Profesora Bartla 19, 19 a, b, c, d, e, Pronaszków, Rabsztyńska, Radnickiego, Rdzawa, Rutkowskiego, Tochowicza, Umińskiej, Wachholza, Warowna, Welońskiego, Zagaje, Zakopiańska nieparzyste od 147 do 181 a, b, c, e, Zawiszy"
219,220,"Szkoła Podstawowa Nr 134, ul. Kłuszyńska 46, Kraków",Powszechny,Tak,"Chorzowska, Dębskiego, Dzikiej Róży, Inicjatywy Lokalnej, Księdza Maja, Kłuszyńska, Libertowska nieparzyste od 1 i parzyste od 2 do 6, 16, Miejscowa, Opatkowicka, Petrażyckiego parzyste od 2 do 60 a i nieparzyste od 1 do 39 g, Poronińska, Smoleńskiego, Solówki parzyste, Starowiejska od 1 do 11, Taklińskiego, Torowa, Ważewskiego, Zakarczmie, Zakopiańska parzyste od 196 i nieparzyste od 183, Zembrzycka"
220,221,"Szkoła Podstawowa Nr 27, ul. Podedworze 16, Kraków",Powszechny,Nie,"Łużycka nieparzyste od 43 do 53 i 71, 71abc, 73, 73 a, 73 c, Podedworze parzyste od 2 do 4"
221,222,"Szkoła Podstawowa Nr 27, ul. Podedworze 16, Kraków",Powszechny,Nie,"Bochenka (bez 12), Podedworze 6, 6 a, 8, 10, 10 b, 12"
222,223,"Szkoła Podstawowa Nr 27, ul. Podedworze 16, Kraków",Powszechny,Nie,"Łużycka 55, 57, 63, 65, 67, 67a, 69"
223,224,"XXIX Liceum Ogólnokształcące, ul. Cechowa 57, Kraków",Powszechny,Tak,"Kordiana, Tuchowska parzyste od 2 do 34 i nieparzyste od 1 do 27"
224,225,"XXIX Liceum Ogólnokształcące, ul. Cechowa 57, Kraków",Powszechny,Tak,"Błogosławionej Franciszki Siedliskiej, Cechowa nieparzyste od 57 i parzyste od 72, Gwarna, Kanarkowa, Kijanki, , Łużycka parzyste od 42 i nieparzyste od 75, Nazaretańska, Pochyła, Podedworze parzyste od 14, Rodziny Jędów, Tuchowska parzyste od 36 do 48 i nieparzyste od 29 do 39, Ukośna, Urwana, Widnokrąg, Zimna"
225,226,"XXIX Liceum Ogólnokształcące, ul. Cechowa 57, Kraków",Powszechny,Tak,"Babiego Lata 24, Cechowa nieparzyste od 1 do 55 i parzyste od 2 do 70, Łężce,  Myślenicka parzyste od 42 do 60 i nieparzyste od 47 do 77, Stojałowskiego nieparzyste od 33 do 41a,  Szarych Szeregów"
226,227,"Przedszkole Samorządowe Nr 33, ul. Rżącka 1, Kraków",Powszechny,Nie,"Badurskiego 1, 9, Bednarska, Biernata z Lublina, Błotna, Ciasna, Czajna, Hallera parzyste od 2 do 14 i nieparzyste od 1 do 7, Kalinowa, Kliniec, Kosocicka parzyste od 72, 79, 85, 85a, 85b, 85c, i nieparzyste od 87 do 105, Księdza Dźwigońskiego, Krystyna z Ostrowa, Łamana, Mokra, Niebieska nieparzyste od 1 do 9 i parzyste od 2 do 10, Obronna od 9, Podedworze nieparzyste, Podlesie, Powały z Taczewa, Przewiewna, Podwórkowa, Przy Kuźni, Rżącka, Sadka, Słona Woda nieparzyste, Snozy, Sporna, Szpakowa, Tyranowskiego 5, 9, 11,  Zyndrama z Maszkowic"
227,228,"Zespół Szkół Elektrycznych Nr 1, ul. Kamieńskiego 49, Kraków",Powszechny,Nie,"Abrahama nieparzyste, Andricia, Bławatkowa, Buraczana, Dauna, Gipsowa, Górska, Heltmana, Kadena-Bandrowskiego, Kamieńskiego od 21, Lecha, Lisa-Kuli, Lubuska, Łuczników, Macedońska 23, Malborska parzyste od 2 do 52 i nieparzyste od 1 do 63, Mieczników, Nadzieja, Nowosądecka 22,  Pańska od 1 do 42, Pierackiego, Siemomysła parzyste, Stoigniewa, Szukiewicza, Tarnowska, Uśmiech, Wielicka nieparzyste od 105 do 113, 113a, 115, Zana"
228,229,"Gimnazjum Nr 27, ul. Malborska 98, Kraków",Powszechny,Nie,"Albańska nieparzyste od 1 do 5 i parzyste od 2 do 8, Gryglewskiego, Krawiecka, Łabędzia, Makowa, Malborska nieparzyste od 65 i parzyste od 54 , Mochnackiego, Pańska od 43, Poprzeczna, Skowronia, Sławka 41, 43, 45, Sportowa, Generała Sułkowskiego, Szczęśliwa, Szkolna, Zabawa, Zmartwychwstania Pańskiego"
229,230,"Gimnazjum Nr 27, ul. Malborska 98, Kraków",Powszechny,Nie,"Andrychowska, Gromady Grudziąż, Karpińskiego, Łapanowska, Łużycka od 1 do 41c, Marcowa, Monterska, Na Łuku, Ondraszka, Ossowskiego, Podgwiezdna, Sempołowskiej, Sławka 54, 56, 58, 62, Turniejowa od 1 do 58 i 60, Wspólna od 22"
230,231,"Gimnazjum Nr 27, ul. Malborska 98, Kraków",Powszechny,Nie,"Bystra, Gminna, Jastrzębia, Klonowica, Kotsisa, Kryształowa, Pszenna, Puszkarska, Generała Roi (bez 4, 4a, 4b, 6), Sławka nieparzyste od 1 do 39 i parzyste od 2 do 52, Strumienna parzyste od 16, Wspólna od 1 do 21, Zielona"
231,232,"Zarząd Infrastruktury Sportowej, ul. Sławka 10, Kraków",Powszechny,Tak,Heila
232,233,"Zespół Szkół Ogólnokształcących Intergracyjnych Nr 7, ul. Czarnogórska 14, Kraków",Powszechny,Tak,"Białoruska 2, 4, 6, 8, 8b, 10, Czarnogórska 15, 18, Serbska 1, 3, Włoska 1, 3, 5, 7, 9, 11"
233,234,"Zespół Szkół Ogólnokształcących Integracyjnych Nr 7, ul. Czarnogórska 14, Kraków",Powszechny,Tak,"Białoruska 15, 17, 19, Lirników, Nowosądecka Nr 46, 48, 50, 52, 54, 56, 58, 60, 62, 64, 72, 74, 78, 80, 82, Poturalskiego, Trybuny Ludów"
234,235,"Zespół Szkół Ogólnokształcących Integracyjnych Nr 7, ul. Czarnogórska 14, Kraków",Powszechny,Tak,"Czarnogórska 1, 3, 5, 7, 9, 9 b, Macedońska 6, Serbska 2, 4, 14, Włoska 6, 8, 13, 15, 17, 19"
235,236,"Zespół Szkół Ogólnokształcących Integracyjnych Nr 7, ul. Czarnogórska 14, Kraków",Powszechny,Tak,"Albańska nieparzyste od 7 i parzyste od 10, Algierska, Czarnogórska 2, 4, 4 c, 6, 8, Estońska 4 i od 6 do 21, 40, Laszczki, Niepokólczyckiego, Trawniki, Włoska 6a, 8a, 8b, Wilgotna, Wolności"
236,237,"Gimnazjum Nr 28, ul. Bujaka 15, Kraków",Powszechny,Tak,"Bujaka (bez 14, 14a, 15, 16, 16a), Łowienicka, Myślenicka parzyste od 34 do 40, Pagórkowa, Stojałowskiego 3, 5, 7"
237,238,"Gimnazjum Nr 28, ul. Bujaka 15, Kraków",Powszechny,Tak,"Okopowa, Bujaka 14, 14a, 15, 16, 16a, Chmielna parzyste, Daliowa, Generała Filipowicza, Herberta (bez nr 8, 10, 12, 14), Storczykowa, Żaka"
238,239,"Gimnazjum Nr 28, ul. Bujaka 15, Kraków",Powszechny,Tak,"Porucznika Halszki, Wysłouchów 1, 1a, 3, 3a, 5"
239,240,"Gimnazjum Nr 28, ul. Bujaka 15, Kraków",Powszechny,Tak,Witosa
240,241,"Gimnazjum Nr 28, ul. Bujaka 15, Kraków",Powszechny,Tak,Turniejowa nieparzyste od 59 i parzyste od 62 (bez 72)
241,242,"Gimnazjum Nr 28, ul. Bujaka 15, Kraków",Powszechny,Tak,"Wysłouchów nieparzyste od 11 do 43, 47, 49, 49a, 51, 51a, 53, 53a, 55, Turniejowa 72"
242,243,"Szkoła Podstawowa Nr 162, ul. Stojałowskiego 31, Kraków",Powszechny,Tak,"Bojki, Wysłouchów 44, 46"
243,244,"Szkoła Podstawowa Nr 162, ul. Stojałowskiego 31, Kraków",Powszechny,Tak,Wysłouchów parzyste od 16 do 42
244,245,"Szkoła Podstawowa Nr 162, ul. Stojałowskiego 31, Kraków",Powszechny,Tak,"Stojałowskiego 9, 11 i nieparzyste od 15 do 29, Wysłouchów parzyste od 2 do 14"
245,246,"Szkoła Podstawowa Nr 55, ul. Dobczycka 20, Kraków",Powszechny,Tak,Gołaśka nieparzyste od 1 do 41
246,247,"Szkoła Podstawowa Nr 55, ul. Dobczycka 20, Kraków",Powszechny,Tak,"Beskidzka parzyste, Dobczycka, Gołaśka parzyste od 2 do 20, Przekątna, Sanocka"
247,248,"Szkoła Podstawowa Nr 55, ul. Dobczycka 20, Kraków",Powszechny,Tak,"Beskidzka nieparzyste, Harcmistrza Millana Nr 22, Madera, Malwowa, Pierzchówka nieparzyste, Przykopy 2, 6 i od 11, Tarnobrzeska, Sas-Zubrzyckiego"
248,249,"Filia Szkoły Podstwowej nr 124 ul. Sucharskiego 36, Kraków",Powszechny,Nie,"Agatowa, Ametystowa, Domagały, Magazynowa 5, Malachitowa, Nad Drwiną, Nefrytowa, Opalowa, Osiedle Kolejowe, Półłanki parzyste od 2 do 74 (bez nr 26), Taborowa, Topazowa, Złocieniowa parzyste od 28 i nieparzyste od 21"
249,250,"Szkoła Podstawowa Nr 124, ul. Weigla 2, Kraków",Powszechny,Nie,"Czarnochowicka, Flanka, Gerberowa, Grzecha, Habeli, Hiacyntowa, Hoyera, Jasieńskiego, Jędrzejczyka, Kameliowa, Kokotowska, Księdza Kusia, Kwatery, Letnia, Mogiłki, Ochocza, Okręglik, Pochwalskiego, Potrzask, Przebiśniegów, Przylaszczki, Pruszyńskiego, Schulza, Stępnia, Stolarza, Szymkiewicza, Tańskiego, Wojciecha z Brudzewa, Zarosie, Zalipki, Zarzyckiego"
250,251,"Szkoła Podstawowa Nr 124, ul. Weigla 2, Kraków",Powszechny,Nie,"Bierkowskiego, Bieżanowska parzyste od 234 do 248, Gardowskiego, Kiepury, Kluszewskiego, Kolonijna, Korepty od 1 do 22, Krzymuskiego, Kurpińskiego, Księdza Prałata Łaczka, Madejówka, Mała Góra nieparzyste, Małka, Nad Serafą, Na Jazkach, Nowaka, Potrzebowskiego, Przecinek, Rakuś, Rygiera, Smolenia, Stryjeńskiego, Szastera, Świdzińskiego, Wielicka parzyste od 248, "
251,252,"Szkoła Podstawowa Nr 124, ul. Weigla 2, Kraków",Powszechny,Nie,"Bieżanowska parzyste od 250, Bogucicka, Braci Jamków, Drożdżowa, Jaglarzów, Jakubca, Kłaka, Koprowa, Korepty od 23, Lipowskiego, Pod Pomnikiem, Księdza Popiełuszki, Pronia, Przełazek, Sucharskiego, Ślósarczyka, Świeża, Śliwy, Weigla, Zamłynie, Złocieniowa parzyste od 2 do 26 i nieparzyste od 1 do 19, Zolla"
252,253,"Szkoła Podstawowa Nr 111, ul. Bieżanowska 204, Kraków",Powszechny,Nie,"Bieżanowska nieparzyste od 155 i parzyste od 128 do 232, Bieżanów blok PKP, Bocznica, Danalówka bez Nr 37, 39, 41, Działkowa, Imielna, Komandora Wrońskiego, Laskowa, Łazy, Ogórkowa, Półłanki nieparzyste od 1 do 31e, Ripperów, Stacyjna"
253,254,"Zespół Szkół Ogólnokształcących Nr 12, ul. Telimeny 9, Kraków",Powszechny,Nie,"Barbary (bez 12), Duża Góra (bez 37, 39, 41), Mała Góra parzyste od 2 do 8, Telimeny od 1 do 4"
254,255,"Zespół Szkół Ogólnokształcących Nr 12, ul. Telimeny 9, Kraków",Powszechny,Nie,"Telimeny 20, 30a, 32 i nieparzyste od 5 do 33 (bez 31) , Opty"
255,256,"Zespół Szkół Ogólnokształcących Nr 12 ul. Telimeny 9, Kraków",Powszechny,Nie,"Ćwiklińskiej, Barbary 12, Duża Góra 37, 39, 41, Telimeny 31"
256,257,"Filia Szkoły Podstawowej Nr 24, ul. Aleksandry 19, Kraków",Powszechny,Nie,"Heleny parzyste od 2 do 20, Mała Góra parzyste od 10 do 14a"
257,258,"Szkoła Podstawowa Nr 24, ul. Aleksandry 17, Kraków",Powszechny,Nie,"Aleksandry 24, 24a, 24b, 24c, 24d, 24e, 24g, 24h, 24i, 24j, 24k, 26, 26c, 28, 38 i nieparzyste od 25, Heleny parzyste od 22, Kaimska, Mała Góra 32, Wielicka parzyste od 230 do 246"
258,259,"Szkoła Podstawowa Nr 24, ul. Aleksandry 17, Kraków",Powszechny,Nie,Mała Góra parzyste od 16 (bez nr 32)
259,260,"Szkoła Podstawowa Nr 24, ul. Aleksandry 17, Kraków",Powszechny,Nie,Aleksandry od 1 do 7
260,261,"Szkoła Podstawowa Nr 24, ul. Aleksandry 17, Kraków",Powszechny,Nie,"Aleksandry od 9 do 23, Jerzmanowskiego 31, Podłęska"
261,262,"Szkoła Podstawowa Nr 41, ul. Jerzmanowskiego 6, Kraków",Powszechny,Nie,Lilli Wenedy (bez 1)
262,263,"Szkoła Podstawowa Nr 41, ul. Jerzmanowskiego 6, Kraków",Powszechny,Nie,"Jerzmanowskiego parzyste od 2 do 16, Lilli Wenedy 1"
263,264,"Szkoła Podstawowa Nr 41, Kraków Jerzmanowskiego 6",Powszechny,Nie,"Jerzmanowskiego parzyste od 18 do 26, Teligi parzyste od 30"
264,265,"szkoła Podstawowa nr 41, ul. Jerzmanowskiego 6, Kraków",Powszechny,Nie,"Konrada Wallenroda, Teligi parzyste od 2 do 6 i nieparzyste od 1"
265,266,"Szkoła Podstawowa Nr 117, ul. Kurczaba 15, Kraków",Powszechny,Nie,Kurczaba nieparzyste
266,267,"Szkoła Podstawowa Nr 117, ul. Kurczaba 15, Kraków",Powszechny,Nie,Kurczaba parzyste
267,268,"Szkoła Podstawowa Nr 117, ul. Kurczaba 15, Kraków",Powszechny,Nie,Teligi parzyste od 8 do 28
268,269,"Szkoła Podstawowa Nr 117, ul. Kurczaba 15, Kraków",Powszechny,Nie,"Jerzmanowskiego parzyste od 28 i nieparzyste 35, 39"
269,270,"Zespół Szkół Ogólnokształcących Integracyjnych Nr 4, ul.Żabia 20, Kraków",Powszechny,Nie,"Badurskiego 13, 13c, 15, 15b, 16, 17, 17a, c, 19 , Jakubowskiego, Kostaneckiego, Kozietulskiego, Medyczna, Obronna od 1 do 8, Księdza Ściegiennego parzyste od 54 i nieparzyste od 43 (bez 57, 69, 71a, 73), Wielicka parzyste od 202 do 228 i nieparzyste od 261 do 265, Żabia"
270,271,"Zespół Szkół Ogólnokształcących Integracyjnych Nr 4, ul. Żabia 20, Kraków",Powszechny,Nie,"Księdza Ściegiennego 57, 69, 71a, 73"
271,272,"Zespół Szkół Ogólnokształcących Nr 15, ul. Rydygiera 20, Kraków",Powszechny,Nie,"Czerwiakowskiego, Kosocicka parzyste od 2 do 70a, nieparzyste od 1 do 71, Schweitzera, Wielicka nieparzyste od 269"
272,273,"Zespół Szkół Ogólnokształcących Nr 15, ul. Rydygiera 20, Kraków",Powszechny,Nie,"Jana XXIII, Rydygiera, Księdza Prymasa Wyszyńskiego, Słona Woda parzyste"
273,274,"Młodzieżowy Dom Kultury - Filia, ul. Na Wrzosach 57, Kraków",Powszechny,Nie,"Bieżanowska 78, 78 a, 80, 80 a, 82, 82 a, 84, 84a, 84 b, 86, 86 b, 88, Górników, Jesienna, Muzyków, Nad Potokiem, Na Wrzosach nieparzyste od 55 i parzyste od 52, Okocimska, Snycerska nieparzyste od 41 i parzyste od 42, Księdza Ściegiennego nieparzyste od 1 do 41 i parzyste od 2 do 52 a"
